
*** Running vivado
    with args -log addrSubtrctr.vdi -applog -m64 -product Vivado -messageDb vivado.pb -mode batch -source addrSubtrctr.tcl -notrace



****** Vivado v2021.1 (64-bit)
  **** SW Build 3247384 on Thu Jun 10 19:36:33 MDT 2021
  **** IP Build 3246043 on Fri Jun 11 00:30:35 MDT 2021
    ** Copyright 1986-2021 Xilinx, Inc. All Rights Reserved.

source addrSubtrctr.tcl -notrace
Command: link_design -top addrSubtrctr -part xc7z007sclg400-1
Design is defaulting to srcset: sources_1
Design is defaulting to constrset: constrs_1
INFO: [Device 21-403] Loading part xc7z007sclg400-1
Netlist sorting complete. Time (s): cpu = 00:00:00 ; elapsed = 00:00:00.001 . Memory (MB): peak = 1281.617 ; gain = 0.000
INFO: [Netlist 29-17] Analyzing 6 Unisim elements for replacement
INFO: [Netlist 29-28] Unisim Transformation completed in 0 CPU seconds
INFO: [Project 1-479] Netlist was created with Vivado 2021.1
INFO: [Project 1-570] Preparing netlist for logic optimization
Parsing XDC File [C:/Users/chand/Desktop/EE214/PROJECTS/BlackboardRevD.xdc]
WARNING: [Vivado 12-584] No ports matched 'led[0]'. [C:/Users/chand/Desktop/EE214/PROJECTS/BlackboardRevD.xdc:11]
CRITICAL WARNING: [Common 17-55] 'set_property' expects at least one object. [C:/Users/chand/Desktop/EE214/PROJECTS/BlackboardRevD.xdc:11]
Resolution: If [get_<value>] was used to populate the object, check to make sure this command returns at least one valid object.
WARNING: [Vivado 12-584] No ports matched 'led[1]'. [C:/Users/chand/Desktop/EE214/PROJECTS/BlackboardRevD.xdc:12]
CRITICAL WARNING: [Common 17-55] 'set_property' expects at least one object. [C:/Users/chand/Desktop/EE214/PROJECTS/BlackboardRevD.xdc:12]
Resolution: If [get_<value>] was used to populate the object, check to make sure this command returns at least one valid object.
WARNING: [Vivado 12-584] No ports matched 'sw[8]'. [C:/Users/chand/Desktop/EE214/PROJECTS/BlackboardRevD.xdc:40]
CRITICAL WARNING: [Common 17-55] 'set_property' expects at least one object. [C:/Users/chand/Desktop/EE214/PROJECTS/BlackboardRevD.xdc:40]
Resolution: If [get_<value>] was used to populate the object, check to make sure this command returns at least one valid object.
WARNING: [Vivado 12-584] No ports matched 'sw[9]'. [C:/Users/chand/Desktop/EE214/PROJECTS/BlackboardRevD.xdc:41]
CRITICAL WARNING: [Common 17-55] 'set_property' expects at least one object. [C:/Users/chand/Desktop/EE214/PROJECTS/BlackboardRevD.xdc:41]
Resolution: If [get_<value>] was used to populate the object, check to make sure this command returns at least one valid object.
WARNING: [Vivado 12-584] No ports matched 'sw[10]'. [C:/Users/chand/Desktop/EE214/PROJECTS/BlackboardRevD.xdc:42]
CRITICAL WARNING: [Common 17-55] 'set_property' expects at least one object. [C:/Users/chand/Desktop/EE214/PROJECTS/BlackboardRevD.xdc:42]
Resolution: If [get_<value>] was used to populate the object, check to make sure this command returns at least one valid object.
WARNING: [Vivado 12-584] No ports matched 'sw[11]'. [C:/Users/chand/Desktop/EE214/PROJECTS/BlackboardRevD.xdc:43]
CRITICAL WARNING: [Common 17-55] 'set_property' expects at least one object. [C:/Users/chand/Desktop/EE214/PROJECTS/BlackboardRevD.xdc:43]
Resolution: If [get_<value>] was used to populate the object, check to make sure this command returns at least one valid object.
WARNING: [Vivado 12-584] No ports matched 'seg_cat[7]'. [C:/Users/chand/Desktop/EE214/PROJECTS/BlackboardRevD.xdc:65]
CRITICAL WARNING: [Common 17-55] 'set_property' expects at least one object. [C:/Users/chand/Desktop/EE214/PROJECTS/BlackboardRevD.xdc:65]
Resolution: If [get_<value>] was used to populate the object, check to make sure this command returns at least one valid object.
Finished Parsing XDC File [C:/Users/chand/Desktop/EE214/PROJECTS/BlackboardRevD.xdc]
INFO: [Opt 31-138] Pushed 0 inverter(s) to 0 load pin(s).
Netlist sorting complete. Time (s): cpu = 00:00:00 ; elapsed = 00:00:00 . Memory (MB): peak = 1281.617 ; gain = 0.000
INFO: [Project 1-111] Unisim Transformation Summary:
No Unisim elements were transformed.

7 Infos, 7 Warnings, 7 Critical Warnings and 0 Errors encountered.
link_design completed successfully
link_design: Time (s): cpu = 00:00:06 ; elapsed = 00:00:08 . Memory (MB): peak = 1281.617 ; gain = 0.000
Command: opt_design
Attempting to get a license for feature 'Implementation' and/or device 'xc7z007s'
INFO: [Common 17-349] Got license for feature 'Implementation' and/or device 'xc7z007s'
Running DRC as a precondition to command opt_design

Starting DRC Task
INFO: [DRC 23-27] Running DRC with 2 threads
INFO: [Project 1-461] DRC finished with 0 Errors
INFO: [Project 1-462] Please refer to the DRC report (report_drc) for more information.

Time (s): cpu = 00:00:02 ; elapsed = 00:00:01 . Memory (MB): peak = 1281.617 ; gain = 0.000

Starting Cache Timing Information Task
INFO: [Timing 38-35] Done setting XDC timing constraints.
Ending Cache Timing Information Task | Checksum: 195e72310

Time (s): cpu = 00:00:10 ; elapsed = 00:00:10 . Memory (MB): peak = 1506.266 ; gain = 224.648

Starting Logic Optimization Task

Phase 1 Retarget
INFO: [Opt 31-138] Pushed 0 inverter(s) to 0 load pin(s).
INFO: [Opt 31-49] Retargeted 0 cell(s).
Phase 1 Retarget | Checksum: 195e72310

Time (s): cpu = 00:00:00 ; elapsed = 00:00:00.031 . Memory (MB): peak = 1725.656 ; gain = 0.000
INFO: [Opt 31-389] Phase Retarget created 0 cells and removed 0 cells

Phase 2 Constant propagation
INFO: [Opt 31-138] Pushed 0 inverter(s) to 0 load pin(s).
Phase 2 Constant propagation | Checksum: 195e72310

Time (s): cpu = 00:00:00 ; elapsed = 00:00:00.035 . Memory (MB): peak = 1725.656 ; gain = 0.000
INFO: [Opt 31-389] Phase Constant propagation created 0 cells and removed 0 cells

Phase 3 Sweep
Phase 3 Sweep | Checksum: 1aea546e7

Time (s): cpu = 00:00:00 ; elapsed = 00:00:00.047 . Memory (MB): peak = 1725.656 ; gain = 0.000
INFO: [Opt 31-389] Phase Sweep created 0 cells and removed 0 cells

Phase 4 BUFG optimization
Phase 4 BUFG optimization | Checksum: 1aea546e7

Time (s): cpu = 00:00:00 ; elapsed = 00:00:00.054 . Memory (MB): peak = 1725.656 ; gain = 0.000
INFO: [Opt 31-662] Phase BUFG optimization created 0 cells of which 0 are BUFGs and removed 0 cells.

Phase 5 Shift Register Optimization
INFO: [Opt 31-1064] SRL Remap converted 0 SRLs to 0 registers and converted 0 registers of register chains to 0 SRLs
Phase 5 Shift Register Optimization | Checksum: 1aea546e7

Time (s): cpu = 00:00:00 ; elapsed = 00:00:00.057 . Memory (MB): peak = 1725.656 ; gain = 0.000
INFO: [Opt 31-389] Phase Shift Register Optimization created 0 cells and removed 0 cells

Phase 6 Post Processing Netlist
Phase 6 Post Processing Netlist | Checksum: 1aea546e7

Time (s): cpu = 00:00:00 ; elapsed = 00:00:00.060 . Memory (MB): peak = 1725.656 ; gain = 0.000
INFO: [Opt 31-389] Phase Post Processing Netlist created 0 cells and removed 0 cells
Opt_design Change Summary
=========================


-------------------------------------------------------------------------------------------------------------------------
|  Phase                        |  #Cells created  |  #Cells Removed  |  #Constrained objects preventing optimizations  |
-------------------------------------------------------------------------------------------------------------------------
|  Retarget                     |               0  |               0  |                                              0  |
|  Constant propagation         |               0  |               0  |                                              0  |
|  Sweep                        |               0  |               0  |                                              0  |
|  BUFG optimization            |               0  |               0  |                                              0  |
|  Shift Register Optimization  |               0  |               0  |                                              0  |
|  Post Processing Netlist      |               0  |               0  |                                              0  |
-------------------------------------------------------------------------------------------------------------------------



Starting Connectivity Check Task

Time (s): cpu = 00:00:00 ; elapsed = 00:00:00 . Memory (MB): peak = 1725.656 ; gain = 0.000
Ending Logic Optimization Task | Checksum: 21c830027

Time (s): cpu = 00:00:00 ; elapsed = 00:00:00.065 . Memory (MB): peak = 1725.656 ; gain = 0.000

Starting Power Optimization Task
INFO: [Pwropt 34-132] Skipping clock gating for clocks with a period < 2.00 ns.
Ending Power Optimization Task | Checksum: 21c830027

Time (s): cpu = 00:00:00 ; elapsed = 00:00:00.015 . Memory (MB): peak = 1725.656 ; gain = 0.000

Starting Final Cleanup Task
Ending Final Cleanup Task | Checksum: 21c830027

Time (s): cpu = 00:00:00 ; elapsed = 00:00:00 . Memory (MB): peak = 1725.656 ; gain = 0.000

Starting Netlist Obfuscation Task
Netlist sorting complete. Time (s): cpu = 00:00:00 ; elapsed = 00:00:00 . Memory (MB): peak = 1725.656 ; gain = 0.000
Ending Netlist Obfuscation Task | Checksum: 21c830027

Time (s): cpu = 00:00:00 ; elapsed = 00:00:00 . Memory (MB): peak = 1725.656 ; gain = 0.000
INFO: [Common 17-83] Releasing license: Implementation
24 Infos, 7 Warnings, 7 Critical Warnings and 0 Errors encountered.
opt_design completed successfully
opt_design: Time (s): cpu = 00:00:14 ; elapsed = 00:00:14 . Memory (MB): peak = 1725.656 ; gain = 444.039
INFO: [Timing 38-480] Writing timing data to binary archive.
Writing placer database...
Writing XDEF routing.
Writing XDEF routing logical nets.
Writing XDEF routing special nets.
Write XDEF Complete: Time (s): cpu = 00:00:01 ; elapsed = 00:00:00.074 . Memory (MB): peak = 1725.656 ; gain = 0.000
INFO: [Common 17-1381] The checkpoint 'C:/Users/chand/Desktop/EE214/PROJECTS/juego_project9/project_9.2/project_9.2.runs/impl_1/addrSubtrctr_opt.dcp' has been generated.
INFO: [runtcl-4] Executing : report_drc -file addrSubtrctr_drc_opted.rpt -pb addrSubtrctr_drc_opted.pb -rpx addrSubtrctr_drc_opted.rpx
Command: report_drc -file addrSubtrctr_drc_opted.rpt -pb addrSubtrctr_drc_opted.pb -rpx addrSubtrctr_drc_opted.rpx
INFO: [IP_Flow 19-234] Refreshing IP repositories
INFO: [IP_Flow 19-1704] No user IP repositories specified
INFO: [IP_Flow 19-2313] Loaded Vivado IP repository 'C:/Users/chand/Desktop/EE214/Vivado/2021.1/data/ip'.
INFO: [Timing 38-35] Done setting XDC timing constraints.
INFO: [DRC 23-27] Running DRC with 2 threads
INFO: [Vivado_Tcl 2-168] The results of DRC are in file C:/Users/chand/Desktop/EE214/PROJECTS/juego_project9/project_9.2/project_9.2.runs/impl_1/addrSubtrctr_drc_opted.rpt.
report_drc completed successfully
Command: place_design
Attempting to get a license for feature 'Implementation' and/or device 'xc7z007s'
INFO: [Common 17-349] Got license for feature 'Implementation' and/or device 'xc7z007s'
INFO: [DRC 23-27] Running DRC with 2 threads
INFO: [Vivado_Tcl 4-198] DRC finished with 0 Errors
INFO: [Vivado_Tcl 4-199] Please refer to the DRC report (report_drc) for more information.
Running DRC as a precondition to command place_design
INFO: [DRC 23-27] Running DRC with 2 threads
INFO: [Vivado_Tcl 4-198] DRC finished with 0 Errors
INFO: [Vivado_Tcl 4-199] Please refer to the DRC report (report_drc) for more information.

Starting Placer Task
INFO: [Place 30-611] Multithreading enabled for place_design using a maximum of 2 CPUs

Phase 1 Placer Initialization

Phase 1.1 Placer Initialization Netlist Sorting
Netlist sorting complete. Time (s): cpu = 00:00:00 ; elapsed = 00:00:00 . Memory (MB): peak = 1769.746 ; gain = 0.000
Phase 1.1 Placer Initialization Netlist Sorting | Checksum: 12fb10c5d

Time (s): cpu = 00:00:00 ; elapsed = 00:00:00.013 . Memory (MB): peak = 1769.746 ; gain = 0.000
Netlist sorting complete. Time (s): cpu = 00:00:00 ; elapsed = 00:00:00 . Memory (MB): peak = 1769.746 ; gain = 0.000

Phase 1.2 IO Placement/ Clock Placement/ Build Placer Device
Phase 1.2 IO Placement/ Clock Placement/ Build Placer Device | Checksum: f486de04

Time (s): cpu = 00:00:00 ; elapsed = 00:00:00.186 . Memory (MB): peak = 1769.746 ; gain = 0.000

Phase 1.3 Build Placer Netlist Model
Phase 1.3 Build Placer Netlist Model | Checksum: 18bb6039f

Time (s): cpu = 00:00:00 ; elapsed = 00:00:00.300 . Memory (MB): peak = 1769.746 ; gain = 0.000

Phase 1.4 Constrain Clocks/Macros
Phase 1.4 Constrain Clocks/Macros | Checksum: 18bb6039f

Time (s): cpu = 00:00:00 ; elapsed = 00:00:00.303 . Memory (MB): peak = 1769.746 ; gain = 0.000
Phase 1 Placer Initialization | Checksum: 18bb6039f

Time (s): cpu = 00:00:00 ; elapsed = 00:00:00.308 . Memory (MB): peak = 1769.746 ; gain = 0.000

Phase 2 Global Placement

Phase 2.1 Floorplanning
Phase 2.1 Floorplanning | Checksum: 16d96b218

Time (s): cpu = 00:00:00 ; elapsed = 00:00:00.420 . Memory (MB): peak = 1769.746 ; gain = 0.000

Phase 2.2 Update Timing before SLR Path Opt
Phase 2.2 Update Timing before SLR Path Opt | Checksum: 1a1d5e369

Time (s): cpu = 00:00:00 ; elapsed = 00:00:00.471 . Memory (MB): peak = 1769.746 ; gain = 0.000

Phase 2.3 Post-Processing in Floorplanning
Phase 2.3 Post-Processing in Floorplanning | Checksum: 1a1d5e369

Time (s): cpu = 00:00:00 ; elapsed = 00:00:00.475 . Memory (MB): peak = 1769.746 ; gain = 0.000

Phase 2.4 Global Placement Core

Phase 2.4.1 Physical Synthesis In Placer
INFO: [Physopt 32-1044] Break lutnm for timing: one critical 0, two critical 0, total 0, new lutff created 0
INFO: [Physopt 32-1138] End 1 Pass. Optimized 0 net or LUT. Breaked 0 LUT, combined 0 existing LUT and moved 0 existing LUT
INFO: [Physopt 32-65] No nets found for high-fanout optimization.
INFO: [Physopt 32-232] Optimized 0 net. Created 0 new instance.
INFO: [Physopt 32-775] End 1 Pass. Optimized 0 net or cell. Created 0 new cell, deleted 0 existing cell and moved 0 existing cell
INFO: [Physopt 32-670] No setup violation found.  DSP Register Optimization was not performed.
INFO: [Physopt 32-670] No setup violation found.  Shift Register to Pipeline Optimization was not performed.
INFO: [Physopt 32-670] No setup violation found.  Shift Register Optimization was not performed.
INFO: [Physopt 32-670] No setup violation found.  BRAM Register Optimization was not performed.
INFO: [Physopt 32-670] No setup violation found.  URAM Register Optimization was not performed.
INFO: [Physopt 32-949] No candidate nets found for dynamic/static region interface net replication
INFO: [Physopt 32-775] End 1 Pass. Optimized 0 net or cell. Created 0 new cell, deleted 0 existing cell and moved 0 existing cell
Netlist sorting complete. Time (s): cpu = 00:00:00 ; elapsed = 00:00:00 . Memory (MB): peak = 1769.746 ; gain = 0.000

Summary of Physical Synthesis Optimizations
============================================


-----------------------------------------------------------------------------------------------------------------------------------------------------------
|  Optimization                                     |  Added Cells  |  Removed Cells  |  Optimized Cells/Nets  |  Dont Touch  |  Iterations  |  Elapsed   |
-----------------------------------------------------------------------------------------------------------------------------------------------------------
|  LUT Combining                                    |            0  |              0  |                     0  |           0  |           1  |  00:00:00  |
|  Retime                                           |            0  |              0  |                     0  |           0  |           1  |  00:00:00  |
|  Very High Fanout                                 |            0  |              0  |                     0  |           0  |           1  |  00:00:00  |
|  DSP Register                                     |            0  |              0  |                     0  |           0  |           0  |  00:00:00  |
|  Shift Register to Pipeline                       |            0  |              0  |                     0  |           0  |           0  |  00:00:00  |
|  Shift Register                                   |            0  |              0  |                     0  |           0  |           0  |  00:00:00  |
|  BRAM Register                                    |            0  |              0  |                     0  |           0  |           0  |  00:00:00  |
|  URAM Register                                    |            0  |              0  |                     0  |           0  |           0  |  00:00:00  |
|  Dynamic/Static Region Interface Net Replication  |            0  |              0  |                     0  |           0  |           1  |  00:00:00  |
|  Total                                            |            0  |              0  |                     0  |           0  |           4  |  00:00:00  |
-----------------------------------------------------------------------------------------------------------------------------------------------------------


Phase 2.4.1 Physical Synthesis In Placer | Checksum: 1df32eaac

Time (s): cpu = 00:00:01 ; elapsed = 00:00:01 . Memory (MB): peak = 1769.746 ; gain = 0.000
Phase 2.4 Global Placement Core | Checksum: 193b29ef2

Time (s): cpu = 00:00:01 ; elapsed = 00:00:01 . Memory (MB): peak = 1769.746 ; gain = 0.000
Phase 2 Global Placement | Checksum: 193b29ef2

Time (s): cpu = 00:00:01 ; elapsed = 00:00:01 . Memory (MB): peak = 1769.746 ; gain = 0.000

Phase 3 Detail Placement

Phase 3.1 Commit Multi Column Macros
Phase 3.1 Commit Multi Column Macros | Checksum: fca336dd

Time (s): cpu = 00:00:02 ; elapsed = 00:00:01 . Memory (MB): peak = 1769.746 ; gain = 0.000

Phase 3.2 Commit Most Macros & LUTRAMs
Phase 3.2 Commit Most Macros & LUTRAMs | Checksum: 2544c7d74

Time (s): cpu = 00:00:02 ; elapsed = 00:00:01 . Memory (MB): peak = 1769.746 ; gain = 0.000

Phase 3.3 Area Swap Optimization
Phase 3.3 Area Swap Optimization | Checksum: 2226e16a9

Time (s): cpu = 00:00:02 ; elapsed = 00:00:01 . Memory (MB): peak = 1769.746 ; gain = 0.000

Phase 3.4 Pipeline Register Optimization
Phase 3.4 Pipeline Register Optimization | Checksum: 2822668f3

Time (s): cpu = 00:00:02 ; elapsed = 00:00:01 . Memory (MB): peak = 1769.746 ; gain = 0.000

Phase 3.5 Small Shape Detail Placement
Phase 3.5 Small Shape Detail Placement | Checksum: 1373e41a0

Time (s): cpu = 00:00:02 ; elapsed = 00:00:01 . Memory (MB): peak = 1769.746 ; gain = 0.000

Phase 3.6 Re-assign LUT pins
Phase 3.6 Re-assign LUT pins | Checksum: 1e614abf1

Time (s): cpu = 00:00:02 ; elapsed = 00:00:01 . Memory (MB): peak = 1769.746 ; gain = 0.000

Phase 3.7 Pipeline Register Optimization
Phase 3.7 Pipeline Register Optimization | Checksum: 2463bf9cb

Time (s): cpu = 00:00:02 ; elapsed = 00:00:01 . Memory (MB): peak = 1769.746 ; gain = 0.000
Phase 3 Detail Placement | Checksum: 2463bf9cb

Time (s): cpu = 00:00:02 ; elapsed = 00:00:01 . Memory (MB): peak = 1769.746 ; gain = 0.000

Phase 4 Post Placement Optimization and Clean-Up

Phase 4.1 Post Commit Optimization
INFO: [Timing 38-35] Done setting XDC timing constraints.

Phase 4.1.1 Post Placement Optimization
Post Placement Optimization Initialization | Checksum: 2388336ba

Phase 4.1.1.1 BUFG Insertion

Starting Physical Synthesis Task

Phase 1 Physical Synthesis Initialization
INFO: [Physopt 32-721] Multithreading enabled for phys_opt_design using a maximum of 2 CPUs
INFO: [Physopt 32-619] Estimated Timing Summary | WNS=5.624 | TNS=0.000 |
Phase 1 Physical Synthesis Initialization | Checksum: 22af18a3f

Time (s): cpu = 00:00:00 ; elapsed = 00:00:00.012 . Memory (MB): peak = 1769.746 ; gain = 0.000
INFO: [Place 46-56] BUFG insertion identified 0 candidate nets. Inserted BUFG: 0, Replicated BUFG Driver: 0, Skipped due to Placement/Routing Conflicts: 0, Skipped due to Timing Degradation: 0, Skipped due to Illegal Netlist: 0.
Ending Physical Synthesis Task | Checksum: 2b2f2fda6

Time (s): cpu = 00:00:00 ; elapsed = 00:00:00.014 . Memory (MB): peak = 1769.746 ; gain = 0.000
Phase 4.1.1.1 BUFG Insertion | Checksum: 2388336ba

Time (s): cpu = 00:00:02 ; elapsed = 00:00:02 . Memory (MB): peak = 1769.746 ; gain = 0.000

Phase 4.1.1.2 Post Placement Timing Optimization
INFO: [Place 30-746] Post Placement Timing Summary WNS=5.624. For the most accurate timing information please run report_timing.
Phase 4.1.1.2 Post Placement Timing Optimization | Checksum: 2902cc583

Time (s): cpu = 00:00:02 ; elapsed = 00:00:02 . Memory (MB): peak = 1769.746 ; gain = 0.000

Time (s): cpu = 00:00:02 ; elapsed = 00:00:02 . Memory (MB): peak = 1769.746 ; gain = 0.000
Phase 4.1 Post Commit Optimization | Checksum: 2902cc583

Time (s): cpu = 00:00:02 ; elapsed = 00:00:02 . Memory (MB): peak = 1769.746 ; gain = 0.000

Phase 4.2 Post Placement Cleanup
Phase 4.2 Post Placement Cleanup | Checksum: 2902cc583

Time (s): cpu = 00:00:02 ; elapsed = 00:00:02 . Memory (MB): peak = 1769.746 ; gain = 0.000

Phase 4.3 Placer Reporting

Phase 4.3.1 Print Estimated Congestion
INFO: [Place 30-612] Post-Placement Estimated Congestion 
 ____________________________________________________
|           | Global Congestion | Short Congestion  |
| Direction | Region Size       | Region Size       |
|___________|___________________|___________________|
|      North|                1x1|                1x1|
|___________|___________________|___________________|
|      South|                1x1|                1x1|
|___________|___________________|___________________|
|       East|                1x1|                1x1|
|___________|___________________|___________________|
|       West|                1x1|                1x1|
|___________|___________________|___________________|

Phase 4.3.1 Print Estimated Congestion | Checksum: 2902cc583

Time (s): cpu = 00:00:02 ; elapsed = 00:00:02 . Memory (MB): peak = 1769.746 ; gain = 0.000
Phase 4.3 Placer Reporting | Checksum: 2902cc583

Time (s): cpu = 00:00:02 ; elapsed = 00:00:02 . Memory (MB): peak = 1769.746 ; gain = 0.000

Phase 4.4 Final Placement Cleanup
Netlist sorting complete. Time (s): cpu = 00:00:00 ; elapsed = 00:00:00 . Memory (MB): peak = 1769.746 ; gain = 0.000

Time (s): cpu = 00:00:02 ; elapsed = 00:00:02 . Memory (MB): peak = 1769.746 ; gain = 0.000
Phase 4 Post Placement Optimization and Clean-Up | Checksum: 1c90c85f3

Time (s): cpu = 00:00:02 ; elapsed = 00:00:02 . Memory (MB): peak = 1769.746 ; gain = 0.000
Ending Placer Task | Checksum: ff00ca4c

Time (s): cpu = 00:00:02 ; elapsed = 00:00:02 . Memory (MB): peak = 1769.746 ; gain = 0.000
INFO: [Common 17-83] Releasing license: Implementation
60 Infos, 7 Warnings, 7 Critical Warnings and 0 Errors encountered.
place_design completed successfully
INFO: [Timing 38-480] Writing timing data to binary archive.
Writing placer database...
Writing XDEF routing.
Writing XDEF routing logical nets.
Writing XDEF routing special nets.
Write XDEF Complete: Time (s): cpu = 00:00:00 ; elapsed = 00:00:00.085 . Memory (MB): peak = 1769.746 ; gain = 0.000
INFO: [Common 17-1381] The checkpoint 'C:/Users/chand/Desktop/EE214/PROJECTS/juego_project9/project_9.2/project_9.2.runs/impl_1/addrSubtrctr_placed.dcp' has been generated.
INFO: [runtcl-4] Executing : report_io -file addrSubtrctr_io_placed.rpt
report_io: Time (s): cpu = 00:00:01 ; elapsed = 00:00:00.066 . Memory (MB): peak = 1769.746 ; gain = 0.000
INFO: [runtcl-4] Executing : report_utilization -file addrSubtrctr_utilization_placed.rpt -pb addrSubtrctr_utilization_placed.pb
INFO: [runtcl-4] Executing : report_control_sets -verbose -file addrSubtrctr_control_sets_placed.rpt
report_control_sets: Time (s): cpu = 00:00:00 ; elapsed = 00:00:00.002 . Memory (MB): peak = 1769.746 ; gain = 0.000
Command: phys_opt_design
Attempting to get a license for feature 'Implementation' and/or device 'xc7z007s'
INFO: [Common 17-349] Got license for feature 'Implementation' and/or device 'xc7z007s'
INFO: [Vivado_Tcl 4-383] Design worst setup slack (WNS) is greater than or equal to 0.000 ns. Skipping all physical synthesis optimizations.
INFO: [Vivado_Tcl 4-232] No setup violation found. The netlist was not modified.
INFO: [Common 17-83] Releasing license: Implementation
69 Infos, 7 Warnings, 7 Critical Warnings and 0 Errors encountered.
phys_opt_design completed successfully
INFO: [Timing 38-480] Writing timing data to binary archive.
Writing placer database...
Writing XDEF routing.
Writing XDEF routing logical nets.
Writing XDEF routing special nets.
Write XDEF Complete: Time (s): cpu = 00:00:00 ; elapsed = 00:00:00.065 . Memory (MB): peak = 1769.746 ; gain = 0.000
INFO: [Common 17-1381] The checkpoint 'C:/Users/chand/Desktop/EE214/PROJECTS/juego_project9/project_9.2/project_9.2.runs/impl_1/addrSubtrctr_physopt.dcp' has been generated.
Command: route_design
Attempting to get a license for feature 'Implementation' and/or device 'xc7z007s'
INFO: [Common 17-349] Got license for feature 'Implementation' and/or device 'xc7z007s'
Running DRC as a precondition to command route_design
INFO: [DRC 23-27] Running DRC with 2 threads
INFO: [Vivado_Tcl 4-198] DRC finished with 0 Errors
INFO: [Vivado_Tcl 4-199] Please refer to the DRC report (report_drc) for more information.


Starting Routing Task
INFO: [Route 35-254] Multithreading enabled for route_design using a maximum of 2 CPUs
Checksum: PlaceDB: fa63a045 ConstDB: 0 ShapeSum: 49d2a07 RouteDB: 0

Phase 1 Build RT Design
Phase 1 Build RT Design | Checksum: 1973cc29c

Time (s): cpu = 00:00:16 ; elapsed = 00:00:14 . Memory (MB): peak = 1806.270 ; gain = 30.832
Post Restoration Checksum: NetGraph: bf9abc4e NumContArr: d7a2064e Constraints: 0 Timing: 0

Phase 2 Router Initialization

Phase 2.1 Create Timer
Phase 2.1 Create Timer | Checksum: 1973cc29c

Time (s): cpu = 00:00:16 ; elapsed = 00:00:14 . Memory (MB): peak = 1806.270 ; gain = 30.832

Phase 2.2 Fix Topology Constraints
Phase 2.2 Fix Topology Constraints | Checksum: 1973cc29c

Time (s): cpu = 00:00:16 ; elapsed = 00:00:14 . Memory (MB): peak = 1812.281 ; gain = 36.844

Phase 2.3 Pre Route Cleanup
Phase 2.3 Pre Route Cleanup | Checksum: 1973cc29c

Time (s): cpu = 00:00:16 ; elapsed = 00:00:14 . Memory (MB): peak = 1812.281 ; gain = 36.844
 Number of Nodes with overlaps = 0

Phase 2.4 Update Timing
Phase 2.4 Update Timing | Checksum: 1cb4f4c1e

Time (s): cpu = 00:00:16 ; elapsed = 00:00:15 . Memory (MB): peak = 1816.273 ; gain = 40.836
INFO: [Route 35-416] Intermediate Timing Summary | WNS=5.539  | TNS=0.000  | WHS=-0.065 | THS=-0.065 |

Phase 2 Router Initialization | Checksum: f69e0e07

Time (s): cpu = 00:00:16 ; elapsed = 00:00:15 . Memory (MB): peak = 1816.273 ; gain = 40.836

Router Utilization Summary
  Global Vertical Routing Utilization    = 0.00182995 %
  Global Horizontal Routing Utilization  = 0 %
  Routable Net Status*
  *Does not include unroutable nets such as driverless and loadless.
  Run report_route_status for detailed report.
  Number of Failed Nets               = 83
    (Failed Nets is the sum of unrouted and partially routed nets)
  Number of Unrouted Nets             = 82
  Number of Partially Routed Nets     = 1
  Number of Node Overlaps             = 0


Phase 3 Initial Routing

Phase 3.1 Global Routing
Phase 3.1 Global Routing | Checksum: f69e0e07

Time (s): cpu = 00:00:16 ; elapsed = 00:00:15 . Memory (MB): peak = 1816.723 ; gain = 41.285
Phase 3 Initial Routing | Checksum: 13745b91e

Time (s): cpu = 00:00:17 ; elapsed = 00:00:15 . Memory (MB): peak = 1816.723 ; gain = 41.285

Phase 4 Rip-up And Reroute

Phase 4.1 Global Iteration 0
 Number of Nodes with overlaps = 1
 Number of Nodes with overlaps = 0
INFO: [Route 35-416] Intermediate Timing Summary | WNS=4.722  | TNS=0.000  | WHS=N/A    | THS=N/A    |

Phase 4.1 Global Iteration 0 | Checksum: 22f2717bd

Time (s): cpu = 00:00:17 ; elapsed = 00:00:15 . Memory (MB): peak = 1816.723 ; gain = 41.285
Phase 4 Rip-up And Reroute | Checksum: 22f2717bd

Time (s): cpu = 00:00:17 ; elapsed = 00:00:15 . Memory (MB): peak = 1816.723 ; gain = 41.285

Phase 5 Delay and Skew Optimization

Phase 5.1 Delay CleanUp
Phase 5.1 Delay CleanUp | Checksum: 22f2717bd

Time (s): cpu = 00:00:17 ; elapsed = 00:00:15 . Memory (MB): peak = 1816.723 ; gain = 41.285

Phase 5.2 Clock Skew Optimization
Phase 5.2 Clock Skew Optimization | Checksum: 22f2717bd

Time (s): cpu = 00:00:17 ; elapsed = 00:00:15 . Memory (MB): peak = 1816.723 ; gain = 41.285
Phase 5 Delay and Skew Optimization | Checksum: 22f2717bd

Time (s): cpu = 00:00:17 ; elapsed = 00:00:15 . Memory (MB): peak = 1816.723 ; gain = 41.285

Phase 6 Post Hold Fix

Phase 6.1 Hold Fix Iter

Phase 6.1.1 Update Timing
Phase 6.1.1 Update Timing | Checksum: 1680f48bd

Time (s): cpu = 00:00:17 ; elapsed = 00:00:15 . Memory (MB): peak = 1816.723 ; gain = 41.285
INFO: [Route 35-416] Intermediate Timing Summary | WNS=4.875  | TNS=0.000  | WHS=0.250  | THS=0.000  |

Phase 6.1 Hold Fix Iter | Checksum: 1680f48bd

Time (s): cpu = 00:00:17 ; elapsed = 00:00:15 . Memory (MB): peak = 1816.723 ; gain = 41.285
Phase 6 Post Hold Fix | Checksum: 1680f48bd

Time (s): cpu = 00:00:17 ; elapsed = 00:00:15 . Memory (MB): peak = 1816.723 ; gain = 41.285

Phase 7 Route finalize

Router Utilization Summary
  Global Vertical Routing Utilization    = 0.0775619 %
  Global Horizontal Routing Utilization  = 0.0303309 %
  Routable Net Status*
  *Does not include unroutable nets such as driverless and loadless.
  Run report_route_status for detailed report.
  Number of Failed Nets               = 0
    (Failed Nets is the sum of unrouted and partially routed nets)
  Number of Unrouted Nets             = 0
  Number of Partially Routed Nets     = 0
  Number of Node Overlaps             = 0

Phase 7 Route finalize | Checksum: 1680f48bd

Time (s): cpu = 00:00:17 ; elapsed = 00:00:15 . Memory (MB): peak = 1816.723 ; gain = 41.285

Phase 8 Verifying routed nets

 Verification completed successfully
Phase 8 Verifying routed nets | Checksum: 1680f48bd

Time (s): cpu = 00:00:17 ; elapsed = 00:00:15 . Memory (MB): peak = 1817.738 ; gain = 42.301

Phase 9 Depositing Routes
Phase 9 Depositing Routes | Checksum: 1cb0a3b5e

Time (s): cpu = 00:00:17 ; elapsed = 00:00:15 . Memory (MB): peak = 1817.738 ; gain = 42.301

Phase 10 Post Router Timing
INFO: [Route 35-57] Estimated Timing Summary | WNS=4.875  | TNS=0.000  | WHS=0.250  | THS=0.000  |

INFO: [Route 35-327] The final timing numbers are based on the router estimated timing analysis. For a complete and accurate timing signoff, please run report_timing_summary.
Phase 10 Post Router Timing | Checksum: 1cb0a3b5e

Time (s): cpu = 00:00:17 ; elapsed = 00:00:15 . Memory (MB): peak = 1817.738 ; gain = 42.301
INFO: [Route 35-16] Router Completed Successfully

Time (s): cpu = 00:00:17 ; elapsed = 00:00:15 . Memory (MB): peak = 1817.738 ; gain = 42.301

Routing Is Done.
INFO: [Common 17-83] Releasing license: Implementation
83 Infos, 7 Warnings, 7 Critical Warnings and 0 Errors encountered.
route_design completed successfully
route_design: Time (s): cpu = 00:00:19 ; elapsed = 00:00:16 . Memory (MB): peak = 1817.738 ; gain = 47.992
INFO: [Timing 38-480] Writing timing data to binary archive.
Writing placer database...
Writing XDEF routing.
Writing XDEF routing logical nets.
Writing XDEF routing special nets.
Write XDEF Complete: Time (s): cpu = 00:00:00 ; elapsed = 00:00:00.080 . Memory (MB): peak = 1827.629 ; gain = 9.891
INFO: [Common 17-1381] The checkpoint 'C:/Users/chand/Desktop/EE214/PROJECTS/juego_project9/project_9.2/project_9.2.runs/impl_1/addrSubtrctr_routed.dcp' has been generated.
INFO: [runtcl-4] Executing : report_drc -file addrSubtrctr_drc_routed.rpt -pb addrSubtrctr_drc_routed.pb -rpx addrSubtrctr_drc_routed.rpx
Command: report_drc -file addrSubtrctr_drc_routed.rpt -pb addrSubtrctr_drc_routed.pb -rpx addrSubtrctr_drc_routed.rpx
INFO: [IP_Flow 19-1839] IP Catalog is up to date.
INFO: [DRC 23-27] Running DRC with 2 threads
INFO: [Vivado_Tcl 2-168] The results of DRC are in file C:/Users/chand/Desktop/EE214/PROJECTS/juego_project9/project_9.2/project_9.2.runs/impl_1/addrSubtrctr_drc_routed.rpt.
report_drc completed successfully
INFO: [runtcl-4] Executing : report_methodology -file addrSubtrctr_methodology_drc_routed.rpt -pb addrSubtrctr_methodology_drc_routed.pb -rpx addrSubtrctr_methodology_drc_routed.rpx
Command: report_methodology -file addrSubtrctr_methodology_drc_routed.rpt -pb addrSubtrctr_methodology_drc_routed.pb -rpx addrSubtrctr_methodology_drc_routed.rpx
INFO: [Timing 38-35] Done setting XDC timing constraints.
INFO: [DRC 23-133] Running Methodology with 2 threads
INFO: [Vivado_Tcl 2-1520] The results of Report Methodology are in file C:/Users/chand/Desktop/EE214/PROJECTS/juego_project9/project_9.2/project_9.2.runs/impl_1/addrSubtrctr_methodology_drc_routed.rpt.
report_methodology completed successfully
INFO: [runtcl-4] Executing : report_power -file addrSubtrctr_power_routed.rpt -pb addrSubtrctr_power_summary_routed.pb -rpx addrSubtrctr_power_routed.rpx
Command: report_power -file addrSubtrctr_power_routed.rpt -pb addrSubtrctr_power_summary_routed.pb -rpx addrSubtrctr_power_routed.rpx
INFO: [Timing 38-35] Done setting XDC timing constraints.
Running Vector-less Activity Propagation...

Finished Running Vector-less Activity Propagation
95 Infos, 7 Warnings, 7 Critical Warnings and 0 Errors encountered.
report_power completed successfully
INFO: [runtcl-4] Executing : report_route_status -file addrSubtrctr_route_status.rpt -pb addrSubtrctr_route_status.pb
INFO: [runtcl-4] Executing : report_timing_summary -max_paths 10 -file addrSubtrctr_timing_summary_routed.rpt -pb addrSubtrctr_timing_summary_routed.pb -rpx addrSubtrctr_timing_summary_routed.rpx -warn_on_violation 
INFO: [Timing 38-91] UpdateTimingParams: Speed grade: -1, Delay Type: min_max.
INFO: [Timing 38-191] Multithreading enabled for timing update using a maximum of 2 CPUs
INFO: [runtcl-4] Executing : report_incremental_reuse -file addrSubtrctr_incremental_reuse_routed.rpt
INFO: [Vivado_Tcl 4-1062] Incremental flow is disabled. No incremental reuse Info to report.
INFO: [runtcl-4] Executing : report_clock_utilization -file addrSubtrctr_clock_utilization_routed.rpt
INFO: [runtcl-4] Executing : report_bus_skew -warn_on_violation -file addrSubtrctr_bus_skew_routed.rpt -pb addrSubtrctr_bus_skew_routed.pb -rpx addrSubtrctr_bus_skew_routed.rpx
INFO: [Timing 38-91] UpdateTimingParams: Speed grade: -1, Delay Type: min_max.
INFO: [Timing 38-191] Multithreading enabled for timing update using a maximum of 2 CPUs
INFO: [Common 17-206] Exiting Vivado at Thu Nov  4 16:18:04 2021...

*** Running vivado
    with args -log addrSubtrctr.vdi -applog -m64 -product Vivado -messageDb vivado.pb -mode batch -source addrSubtrctr.tcl -notrace



****** Vivado v2021.1 (64-bit)
  **** SW Build 3247384 on Thu Jun 10 19:36:33 MDT 2021
  **** IP Build 3246043 on Fri Jun 11 00:30:35 MDT 2021
    ** Copyright 1986-2021 Xilinx, Inc. All Rights Reserved.

source addrSubtrctr.tcl -notrace
Command: open_checkpoint addrSubtrctr_routed.dcp

Time (s): cpu = 00:00:00 ; elapsed = 00:00:00.053 . Memory (MB): peak = 1283.391 ; gain = 0.000
INFO: [Device 21-403] Loading part xc7z007sclg400-1
Netlist sorting complete. Time (s): cpu = 00:00:00 ; elapsed = 00:00:00.001 . Memory (MB): peak = 1283.391 ; gain = 0.000
INFO: [Netlist 29-17] Analyzing 6 Unisim elements for replacement
INFO: [Netlist 29-28] Unisim Transformation completed in 0 CPU seconds
INFO: [Project 1-479] Netlist was created with Vivado 2021.1
INFO: [Project 1-570] Preparing netlist for logic optimization
INFO: [Timing 38-478] Restoring timing data from binary archive.
INFO: [Timing 38-479] Binary timing data restore complete.
INFO: [Project 1-856] Restoring constraints from binary archive.
INFO: [Project 1-853] Binary constraint restore complete.
Reading XDEF placement.
Reading placer database...
Reading XDEF routing.
Read XDEF File: Time (s): cpu = 00:00:00 ; elapsed = 00:00:00.152 . Memory (MB): peak = 1503.875 ; gain = 7.062
Restored from archive | CPU: 0.000000 secs | Memory: 0.000000 MB |
Finished XDEF File Restore: Time (s): cpu = 00:00:00 ; elapsed = 00:00:00.152 . Memory (MB): peak = 1503.875 ; gain = 7.062
Netlist sorting complete. Time (s): cpu = 00:00:00 ; elapsed = 00:00:00 . Memory (MB): peak = 1503.875 ; gain = 0.000
INFO: [Project 1-111] Unisim Transformation Summary:
No Unisim elements were transformed.

INFO: [Project 1-604] Checkpoint was created with Vivado v2021.1 (64-bit) build 3247384
open_checkpoint: Time (s): cpu = 00:00:16 ; elapsed = 00:00:18 . Memory (MB): peak = 1503.875 ; gain = 220.484
Command: write_bitstream -force addrSubtrctr.bit
Attempting to get a license for feature 'Implementation' and/or device 'xc7z007s'
INFO: [Common 17-349] Got license for feature 'Implementation' and/or device 'xc7z007s'
Running DRC as a precondition to command write_bitstream
INFO: [IP_Flow 19-234] Refreshing IP repositories
INFO: [IP_Flow 19-1704] No user IP repositories specified
INFO: [IP_Flow 19-2313] Loaded Vivado IP repository 'C:/Users/chand/Desktop/EE214/Vivado/2021.1/data/ip'.
INFO: [DRC 23-27] Running DRC with 2 threads
WARNING: [DRC ZPS7-1] PS7 block required: The PS7 cell must be used in this Zynq design in order to enable correct default configuration.
INFO: [Vivado 12-3199] DRC finished with 0 Errors, 1 Warnings
INFO: [Vivado 12-3200] Please refer to the DRC report (report_drc) for more information.
INFO: [Designutils 20-2272] Running write_bitstream with 2 threads.
Loading data files...
Loading site data...
Loading route data...
Processing options...
Creating bitmap...
Creating bitstream...
Writing bitstream ./addrSubtrctr.bit...
INFO: [Vivado 12-1842] Bitgen Completed Successfully.
INFO: [#UNDEF] WebTalk data collection is mandatory when using a WebPACK part without a full Vivado license. To see the specific WebTalk data collected for your design, open the usage_statistics_webtalk.html or usage_statistics_webtalk.xml file in the implementation directory.
INFO: [Common 17-186] 'C:/Users/chand/Desktop/EE214/PROJECTS/juego_project9/project_9.2/project_9.2.runs/impl_1/usage_statistics_webtalk.xml' has been successfully sent to Xilinx on Thu Nov  4 16:19:12 2021. For additional details about this file, please refer to the WebTalk help file at C:/Users/chand/Desktop/EE214/Vivado/2021.1/doc/webtalk_introduction.html.
INFO: [Common 17-83] Releasing license: Implementation
23 Infos, 1 Warnings, 0 Critical Warnings and 0 Errors encountered.
write_bitstream completed successfully
write_bitstream: Time (s): cpu = 00:00:15 ; elapsed = 00:00:16 . Memory (MB): peak = 1976.699 ; gain = 472.824
INFO: [Common 17-206] Exiting Vivado at Thu Nov  4 16:19:12 2021...
